<?xml version="1.0" encoding="UTF-8"?>
<credits xmlns="http://www.scoppelletti.it/ns/credits/1"
         xmlns:xsi="http://www.w3.org/2001/XMLSchema-instance"
         xsi:schemaLocation="http://www.scoppelletti.it/ns/credits/1 http://www.scoppelletti.it/res/spaceship/gradle/android/tasks/credits1.xsd">
    <credit key="component1">
        <component>Component 1</component>
        <ownerRef keyref="owner1" />
        <licenseRef keyref="owner2" />
        <artifacts>
            <artifact groupId="group1" artifactId="name1" />
        </artifacts>
    </credit>
    <owners>
        <owner key="owner1">Owner 1</owner>
        <owner key="owner2">Owner 2</owner>
    </owners>
    <licenses>
        <license key="license1">License 1</license>
        <license key="license2">License 2</license>
    </licenses>
</credits>
